{
  "$schema": "https://json-schema.org/draft/2020-12/schema",
  "$id": "https://raw.githubusercontent.com/falsable/a2dlc/main/contracts/factory-holdout.schema.json",
  "title": "Sealed holdout of a factory run (holdout.json)",
  "description": "Where the sealed holdout lives and how to run it against an integrated tree. The folder holds SEAL (the sha256 of MANIFEST.sha256) and MANIFEST.sha256 (the sha256 of every other file); `seal` here must equal SEAL, so a spec cannot point at a holdout other than the one it names. cmd/factory mounts the folder read-only at /holdout and the checkout read-only at /src, with no network, only while it validates a lane on the integration branch; `command` assembles the checkout and the tests inside the container and its exit code is the verdict. The environment carries HOLDOUT_FILES: the files of the units to run, space separated.",
  "type": "object",
  "properties": {
    "schema_version": { "$ref": "defs.schema.json#/$defs/schema_version" },
    "dir": { "type": "string", "minLength": 1, "description": "Host folder of the sealed holdout. Never inside the checkout that is validated." },
    "seal": { "type": "string", "pattern": "^[0-9a-f]{64}$" },
    "image": { "type": "string", "minLength": 1 },
    "command": { "type": "string", "minLength": 1, "description": "Run with sh -c in the image; /src is the checkout (read-only), /holdout the sealed folder (read-only), the working directory is empty and writable." },
    "units": {
      "type": "array",
      "minItems": 1,
      "description": "Which holdout files decide which issue. An accepted lane's issue must be listed here; a lane without a unit cannot be integrated.",
      "items": {
        "type": "object",
        "properties": {
          "issue_id": { "type": "string", "pattern": "^[a-z][a-z0-9_-]{0,39}$" },
          "files": { "type": "array", "minItems": 1, "items": { "type": "string", "minLength": 1 } }
        },
        "required": ["issue_id", "files"],
        "additionalProperties": false
      }
    },
    "timeout_s": { "type": "integer", "minimum": 1 },
    "memory": { "type": "string", "pattern": "^[0-9]+[kmg]$" },
    "cpus": { "type": "number", "exclusiveMinimum": 0 }
  },
  "required": ["schema_version", "dir", "seal", "image", "command", "units"],
  "additionalProperties": false
}
