{
  "schema_version": 1,
  "dir": "e2e/testdata/factory-holdout",
  "seal": "a6af6992722edaac6d5b5c2e22b97578812f9cc9c091d89da4cb26389076ed47",
  "image": "a2dlc-factory-node-cov:0.1",
  "command": "mkdir /w && tar -C /src --exclude=node_modules --exclude=.git -cf - . | tar -C /w -xf - && cd /w && ln -s /deps/node_modules node_modules && mkdir -p test/_holdout && cp /holdout/tests/* test/_holdout/ && sed -i 's#\\.\\./src/#../../src/#' test/_holdout/helpers.ts && ./node_modules/.bin/vitest run $(for f in $HOLDOUT_FILES; do echo test/_holdout/$f; done)",
  "units": [
    { "issue_id": "issue-1", "files": ["h01.test.ts"] },
    { "issue_id": "issue-2", "files": ["h02.test.ts"] }
  ],
  "timeout_s": 600,
  "memory": "2g",
  "cpus": 2
}
